English	Foreign	Transliteration	Context
Anton and Maria	Антон и Мария	-	Make introductions
He is a teacher.	Он учитель.	-	Make introductions
Hi, I am here.	Привет, я здесь.	-	Make introductions
Hi, I am Nina.	Привет, я Нина.	-	Make introductions
Hi, I am Victor.	Привет, я Виктор.	-	Make introductions
Maria, she is here.	Мария, она здесь.	-	Make introductions
Hi, Dima.	Привет, Дима.	-	Make introductions
Hi, Katya!	Привет, Катя!	-	Make introductions
Thank you, Mark.	Спасибо, Марк.	-	Make introductions
Mom, this is Dima.	Мама, это Дима.	-	Make introductions
Hi, I am a teacher.	Привет, я учитель.	-	Make introductions
Victor is here.	Виктор здесь.	-	Make introductions
Is she here?	Она здесь?	-	Talk about your job
Is this Dima?	Это Дима?	-	Talk about your job
Are you a psychologist?	Ты психолог?	-	Talk about your job
You are not my dad.	Ты не мой папа.	-	Talk about your job
Yes, my friend is a coach.	Да, мой друг — тренер.	-	Talk about your job
This is Anton. He is a cook.	Это Антон. Он повар.	-	Talk about your job
Are you here?	Ты здесь?	-	Talk about your job
I am not you.	Я не ты.	-	Talk about your job
Is this Anton?	Это Антон?	-	Talk about your job
He is not a captain. He is a doctor.	Он не капитан. Он доктор.	-	Talk about your job
He is not a pilot. He is an engineer.	Он не пилот. Он инженер.	-	Talk about your job
Mom and Dad	мама и папа	-	Talk about your job
This is my friend, Mark.	Это мой друг, Марк.	-	Talk about your job
Hi. Are you a pilot?	Привет. Ты пилот?	-	Talk about your job
I am not a psychologist.	Я не психолог.	-	Talk about your job
Who is he?	Кто он?	-	Talk about your job
I am a pilot.	Я пилот.	-	Talk about your job
Is Yulia here?	Юлия здесь?	-	Talk about your job
Yes, I am Mark.	Да, я Марк.	-	Talk about your job
This is meat.	Это мясо.	-	Discuss food and drink
bread and milk	хлеб и молоко	-	Discuss food and drink
I eat soup.	Я ем суп.	-	Discuss food and drink
I do not want juice.	Я не хочу сок.	-	Discuss food and drink
He does not drink milk.	Он не пьёт молоко.	-	Discuss food and drink
She does not drink juice.	Она не пьёт сок.	-	Discuss food and drink
the menu	меню	-	Discuss food and drink
I drink milk.	Я пью молоко.	-	Discuss food and drink
soup	суп	-	Discuss food and drink
Yes, I eat cheese.	Да, я ем сыр.	-	Discuss food and drink
I do not eat cheese.	Я не ем сыр.	-	Discuss food and drink
Nina does not eat cheese.	Нина не ест сыр.	-	Discuss food and drink
I eat bread.	Я ем хлеб.	-	Discuss food and drink
The cook eats the cheese.	Повар ест сыр.	-	Discuss food and drink
I do not eat soup.	Я не ем суп.	-	Discuss food and drink
I do not eat meat.	Я не ем мясо.	-	Discuss food and drink
the doctor and the teacher	доктор и учитель	-	Discuss food and drink
soup and milk	суп и молоко	-	Discuss food and drink
coffee	кофе	-	Discuss food and drink
The teacher is here.	Учитель здесь.	-	Discuss food and drink
Does Nina eat meat?	Нина ест мясо?	-	Discuss food and drink
Is the cook here?	Повар здесь?	-	Discuss food and drink
She drinks wine.	Она пьёт вино.	-	Discuss food and drink
the cheese and the meat	сыр и мясо	-	Discuss food and drink
Yes, this is cheese.	Да, это сыр.	-	Discuss food and drink
I eat the meat and the bread.	Я ем мясо и хлеб.	-	Discuss food and drink
Do I drink wine?	Я пью вино?	-	Discuss food and drink
a man and a cat	мужчина и кошка	-	Form basic sentences
Ukraine or Brazil?	Украина или Бразилия?	-	Form basic sentences
a boy	мальчик	-	Form basic sentences
America	Америка	-	Form basic sentences
women	женщины	-	Form basic sentences
No, they are not here.	Нет, они не здесь.	-	Form basic sentences
No, this is not America.	Нет, это не Америка.	-	Form basic sentences
Is this America or Canada?	Это Америка или Канада?	-	Form basic sentences
This is Brazil.	Это Бразилия.	-	Form basic sentences
Yes, the cat is here.	Да, кошка здесь.	-	Form basic sentences
house	дом	-	Form basic sentences
Yes, this is my house.	Да, это мой дом.	-	Form basic sentences
No, Yulia does not eat meat.	Нет, Юлия не ест мясо.	-	Form basic sentences
The dog does not eat cheese.	Собака не ест сыр.	-	Form basic sentences
Russia	Россия	-	Form basic sentences
Is this Canada or Russia?	Это Канада или Россия?	-	Form basic sentences
Canada	Канада	-	Form basic sentences
Canada and Russia	Канада и Россия	-	Form basic sentences
This is a dog.	Это собака.	-	Form basic sentences
She is eating meat.	Она ест мясо.	-	Form basic sentences
No, thank you.	Нет, спасибо.	-	Form basic sentences
This is an apple.	Это яблоко.	-	Form basic sentences
Is this a dog or a cat?	Это собака или кошка?	-	Form basic sentences
Italy and Mongolia	Италия и Монголия	-	Form basic sentences
a woman and a girl	женщина и девочка	-	Form basic sentences
Bread, please.	Хлеб, пожалуйста.	-	Greet people
How are you doing?	Как дела?	-	Greet people
Excuse me, where is the park?	Извините, где парк?	-	Greet people
day	день	-	Greet people
Good morning.	Доброе утро.	-	Greet people
Well, bye!	Ну, пока!	-	Greet people
The park is here.	Парк здесь.	-	Greet people
Everything is fine.	Всё хорошо.	-	Greet people
Goodbye.	До свидания.	-	Greet people
Yes, my dad is there.	Да, мой папа там.	-	Greet people
Excuse me, where is my tea?	Извините, где мой чай?	-	Greet people
Good afternoon, is Mom here?	Добрый день, мама здесь?	-	Greet people
Tea, please.	Чай, пожалуйста.	-	Greet people
Yes, I have tea.	Да, у меня есть чай.	-	Greet people
Bye, Mom!	Пока, мама!	-	Greet people
Milk, please.	Молоко, пожалуйста.	-	Greet people
Excuse me.	Извините.	-	Greet people
Mom is there.	Мама там.	-	Greet people
Coffee, please.	Кофе, пожалуйста.	-	Greet people
Thank you, she is already here.	Спасибо, она уже здесь.	-	Greet people
Of course!	Конечно!	-	Greet people
Yes, please.	Да, пожалуйста.	-	Greet people
Where is the park?	Где парк?	-	Greet people
Yes, this is my soup.	Да, это мой суп.	-	Greet people
This is a park.	Это парк.	-	Greet people
Alexandra drinks tea.	Александра пьёт чай.	-	Identify common objects
my child	мой ребёнок	-	Identify common objects
our egg	наше яйцо	-	Identify common objects
table	стол	-	Identify common objects
children	дети	-	Identify common objects
taxi	такси	-	Identify common objects
our plan	наш план	-	Identify common objects
our menu	наше меню	-	Identify common objects
bicycle	велосипед	-	Identify common objects
They have milk.	У них есть молоко.	-	Identify common objects
They have apples.	У них есть яблоки.	-	Identify common objects
Does he have a plan?	У него есть план?	-	Identify common objects
This is our phone.	Это наш телефон.	-	Identify common objects
telephone	телефон	-	Identify common objects
They have water.	У них есть вода.	-	Identify common objects
Where is our taxi?	Где наше такси?	-	Identify common objects
This isn't our table.	Это не наш стол.	-	Identify common objects
We already have children.	У нас уже есть дети.	-	Identify common objects
I am already in the cafe.	Я уже в кафе.	-	Identify common objects
my office	мой офис	-	Identify common objects
banana	банан	-	Identify common objects
He drinks milk.	Он пьёт молоко.	-	Identify common objects
This person eats bread.	Этот человек ест хлеб.	-	Identify common objects
We are brother and sister.	Мы брат и сестра.	-	Identify common objects
cafe	кафе	-	Identify common objects
coffee and a banana	кофе и банан	-	Identify common objects
The children are already here.	Дети уже здесь.	-	Identify common objects
The horse is eating an apple.	Лошадь ест яблоко.	-	Identify common objects
Katya is eating an egg.	Катя ест яйцо.	-	Identify common objects
this bicycle	этот велосипед	-	Identify common objects
Where are the girls?	Где девочки?	-	Form plurals
Do you have notebooks?	У вас есть тетради?	-	Form plurals
my tables	мои столы	-	Form plurals
towel	полотенце	-	Form plurals
You have horses.	У вас есть лошади.	-	Form plurals
Our cats eat eggs.	Наши кошки едят яйца.	-	Form plurals
Our actors do not eat apples.	Наши актёры не едят яблоки.	-	Form plurals
Men eat bread.	Мужчины едят хлеб.	-	Form plurals
Do you have tables?	У вас есть столы?	-	Form plurals
cats	кошки	-	Form plurals
We have cats.	У нас есть кошки.	-	Form plurals
These actors are already in the taxi.	Эти актёры уже в такси.	-	Form plurals
Where's the lake?	Где озеро?	-	Form plurals
men and women	мужчины и женщины	-	Form plurals
my horses	мои лошади	-	Form plurals
Are the lakes here?	Озёра здесь?	-	Form plurals
Where are the actors?	Где актёры?	-	Form plurals
Are these tables?	Это столы?	-	Form plurals
Where are the eggs?	Где яйца?	-	Form plurals
These are lakes.	Это озёра.	-	Form plurals
our actors	наши актёры	-	Form plurals
my plans	мои планы	-	Form plurals
This is a lake.	Это озеро.	-	Form plurals
Are they actors?	Они актёры?	-	Form plurals
My towels are here.	Мои полотенца здесь.	-	Form plurals
my towels	мои полотенца	-	Form plurals
The sisters are eating soup.	Сёстры едят суп.	-	Form plurals
Are you at home?	Ты дома?	-	Say where you are
Yes, Boston is far away.	Да, Бостон далеко.	-	Say where you are
Do we have doors?	У нас есть двери?	-	Say where you are
store	магазин	-	Say where you are
stone	камень	-	Say where you are
my school	моя школа	-	Say where you are
my door	моя дверь	-	Say where you are
tree	дерево	-	Say where you are
This stone is in the cafe.	Этот камень в кафе.	-	Say where you are
Sorry, this is not a store.	Извините, это не магазин.	-	Say where you are
The stone is already on the table.	Камень уже на столе.	-	Say where you are
Mom is already at work.	Мама уже на работе.	-	Say where you are
This bed is not in its place.	Эта кровать не на месте.	-	Say where you are
my mom	моя мама	-	Say where you are
Germany	Германия	-	Say where you are
We are in America now.	Мы сейчас в Америке.	-	Say where you are
This is Moscow.	Это Москва.	-	Say where you are
This is not the square.	Это не площадь.	-	Say where you are
Where is my pencil?	Где мой карандаш?	-	Say where you are
my doors	мои двери	-	Say where you are
No, the door is here.	Нет, дверь здесь.	-	Say where you are
Where is Germany?	Где Германия?	-	Say where you are
He is in the bathroom.	Он в туалете.	-	Say where you are
I am not at home.	Я не дома.	-	Say where you are
Where is the store?	Где магазин?	-	Say where you are
my water	моя вода	-	Say where you are
my ticket	мой билет	-	Talk about trips
my luggage	мой багаж	-	Talk about trips
car	машина	-	Talk about trips
hotel	отель	-	Talk about trips
I am looking for the exit.	Я ищу выход.	-	Talk about trips
train	поезд	-	Talk about trips
My visa is on the table.	Моя виза на столе.	-	Talk about trips
No, the exit is not here.	Нет, выход не здесь.	-	Talk about trips
I am looking for the tickets, where are they?	Я ищу билеты, где они?	-	Talk about trips
Is this your car?	Это твоя машина?	-	Talk about trips
Excuse me, where is the exit?	Извините, где выход?	-	Talk about trips
luggage	багаж	-	Talk about trips
No, I am not looking for the passport.	Нет, я не ищу паспорт.	-	Talk about trips
Where is your luggage?	Где твой багаж?	-	Talk about trips
My car is not here.	Моя машина не здесь.	-	Talk about trips
No, this is not your stop.	Нет, это не твоя остановка.	-	Talk about trips
Is this an airport?	Это аэропорт?	-	Talk about trips
this car	эта машина	-	Talk about trips
The tickets are here.	Билеты здесь.	-	Talk about trips
Here is the exit.	Вот выход.	-	Talk about trips
This is not a hotel.	Это не отель.	-	Talk about trips
Our hotel is far away.	Наш отель далеко.	-	Talk about trips
This is not a visa.	Это не виза.	-	Talk about trips
my duck	моя утка	-	Name common animals
crocodile	крокодил	-	Name common animals
Where is my deer?	Где мой олень?	-	Name common animals
Is this a snake?	Это змея?	-	Name common animals
pig	свинья	-	Name common animals
dogs or cats	собаки или кошки	-	Name common animals
a hare and a wolf	заяц и волк	-	Name common animals
chicken	курица	-	Name common animals
my pig and my cat	моя свинья и моя кошка	-	Name common animals
A duck is not a chicken.	Утка - это не курица.	-	Name common animals
The duck and the chicken are birds.	Утка и курица - птицы.	-	Name common animals
my ducks	мои утки	-	Name common animals
Ducks are birds.	Утки — это птицы.	-	Name common animals
The squirrel is drinking milk.	Белка пьёт молоко.	-	Name common animals
Our elephant is not eating.	Наш слон не ест.	-	Name common animals
my bird	моя птица	-	Name common animals
The pig is eating an apple.	Свинья ест яблоко.	-	Name common animals
The cow is in the cafe.	Корова в кафе.	-	Name common animals
I am not an elephant!	Я не слон!	-	Name common animals
These are my foxes.	Это мои лисы.	-	Name common animals
our owls	наши совы	-	Name common animals
The bear is eating.	Медведь ест.	-	Name common animals
The wolf is eating.	Волк ест.	-	Name common animals
The lion is eating.	Лев ест.	-	Name common animals
Where are my foxes?	Где мои лисы?	-	Name common animals
What is wrong?	Что не так?	-	Thank people
Excuse me, Dad.	Извини, папа.	-	Thank people
Excuse me, are you busy?	Извини, ты занят?	-	Thank people
No, I'm not busy.	Нет, я не занят.	-	Thank people
Are you Vera Ivanovna? Excellent!	Вы Вера Ивановна? Отлично!	-	Thank people
Are you Alexandra Ivanovna? Excellent!	Вы Александра Ивановна? Отлично!	-	Thank people
Is your name Ivan Ivanovich?	Вас зовут Иван Иванович?	-	Thank people
I am Vera. And you?	Я Вера. А ты?	-	Thank people
Vera, where's your cat?	Вера, где твоя кошка?	-	Thank people
Hi, is your name Ivan?	Привет, тебя зовут Иван?	-	Thank people
Excuse me, what is your name?	Извините, как вас зовут?	-	Thank people
Is Ivan Ivanovich already here?	Иван Иванович уже здесь?	-	Thank people
Excuse me, do you have a sister?	Извини, у тебя есть сестра?	-	Thank people
Good morning, are you Vera and Vanya?	Доброе утро, вы Вера и Ваня?	-	Thank people
Can you tell me where Mom is?	Можете сказать, где мама?	-	Thank people
Hi, is your name Alexandra?	Привет, тебя зовут Александра?	-	Thank people
This isn't Vera Ivanovna.	Это не Вера Ивановна.	-	Thank people
Mark is at home. And you?	Марк дома. А вы?	-	Thank people
What is your name?	Как вас зовут?	-	Thank people
Excuse me, Mom.	Извини, мама.	-	Thank people
No, my name is Victoria.	Нет, меня зовут Виктория.	-	Thank people
Good morning, what is your name?	Доброе утро, как вас зовут?	-	Thank people
Yes, my name is Ivan.	Да, меня зовут Иван.	-	Thank people
Tanya, what is wrong?	Таня, что не так?	-	Thank people
Hello, I am Ivan Chernov.	Здравствуйте, я Иван Чернов.	-	Thank people
Forgive me!	Простите!	-	Thank people
Where is Ivan Chernov?	Где Иван Чернов?	-	Thank people
Hello, Ivan.	Здравствуйте, Иван.	-	Thank people
This is our restaurant.	Это наш ресторан.	-	Say where you are from
Is she from Russia?	Она из России?	-	Say where you are from
restaurant	ресторан	-	Say where you are from
Norway	Норвегия	-	Say where you are from
Our doctor is from Italy.	Наш доктор из Италии.	-	Say where you are from
This cook is from India.	Этот повар из Индии.	-	Say where you are from
This actor is from Korea.	Этот актёр из Кореи.	-	Say where you are from
Is he from Brazil or Germany?	Он из Бразилии или Германии?	-	Say where you are from
Are you from Canada?	Ты из Канады?	-	Say where you are from
Is he from Mongolia?	Он из Монголии?	-	Say where you are from
Are you nearby?	Вы близко?	-	Say where you are from
a room	комната	-	Say where you are from
No, we are not from America.	Нет, мы не из Америки.	-	Say where you are from
Are you from Norway?	Ты из Норвегии?	-	Say where you are from
Victor lives near the station.	Виктор живёт возле станции.	-	Say where you are from
The doctor is not at the bank.	Доктор не в банке.	-	Say where you are from
Is Maria from America?	Мария из Америки?	-	Say where you are from
My mom is from Canada.	Моя мама из Канады.	-	Say where you are from
My brother is from Norway.	Мой брат из Норвегии.	-	Say where you are from
What is on the left?	Что слева?	-	Say where you are from
Victoria is from Russia.	Виктория из России.	-	Say where you are from
I am from Germany.	Я из Германии.	-	Say where you are from
My house is near the station.	Мой дом возле станции.	-	Say where you are from
She is on the right.	Она справа.	-	Say where you are from
Are they from America?	Они из Америки?	-	Say where you are from
Do you eat rice?	Ты ешь рис?	-	Talk about what people have
She does not have a pizza.	У неё нет пиццы.	-	Talk about what people have
rice	рис	-	Talk about what people have
Don't you have a cat?	У тебя нет кошки?	-	Talk about what people have
butter	масло	-	Talk about what people have
The woman has bread.	У женщины есть хлеб.	-	Talk about what people have
Mom does not have a dog.	У мамы нет собаки.	-	Talk about what people have
Well, I do not have juice.	Ну, у меня нет сока.	-	Talk about what people have
I do not drink tea.	Я не пью чай.	-	Talk about what people have
Mom does not have a duck.	У мамы нет утки.	-	Talk about what people have
The girl does not have juice.	У девочки нет сока.	-	Talk about what people have
Dad does not have a table.	У папы нет стола.	-	Talk about what people have
my butter	моё масло	-	Talk about what people have
Don't you have soup?	У тебя нет супа?	-	Talk about what people have
Where is the butter?	Где масло?	-	Talk about what people have
I do not have a cat.	У меня нет кошки.	-	Talk about what people have
He does not have a pencil.	У него нет карандаша.	-	Talk about what people have
They do not have a dog.	У них нет собаки.	-	Talk about what people have
The teacher doesn't have soup.	У учителя нет супа.	-	Talk about what people have
We do not have juice.	У нас нет сока.	-	Talk about what people have
The cat does not have an apple.	У кошки нет яблока.	-	Talk about what people have
Mom does not have tea.	У мамы нет чая.	-	Talk about what people have
Do you have juice?	У вас есть сок?	-	Talk about what people have
You do not have butter.	У тебя нет масла.	-	Talk about what people have
Mom has a brother.	У мамы есть брат.	-	Talk about what people have
Mom does not have a brother.	У мамы нет брата.	-	Talk about what people have
We do not have butter.	У нас нет масла.	-	Talk about what people have
The woman does not have a brother.	У женщины нет брата.	-	Talk about what people have
last week	прошлая неделя	-	Discuss possessions
my path	мой путь	-	Discuss possessions
your word	твоё слово	-	Discuss possessions
night	ночь	-	Discuss possessions
book	книга	-	Discuss possessions
movie	фильм	-	Discuss possessions
This is not a radio, Mom.	Это не радио, мама.	-	Discuss possessions
Vanya, here is your towel.	Ваня, вот твоё полотенце.	-	Discuss possessions
Here is your menu, and here is mine.	Вот твоё меню, а вот моё.	-	Discuss possessions
radio	радио	-	Discuss possessions
last night	прошлая ночь	-	Discuss possessions
Is this your movie?	Это твой фильм?	-	Discuss possessions
Their sisters drink tea.	Их сёстры пьют чай.	-	Discuss possessions
Their book is already here.	Их книга уже здесь.	-	Discuss possessions
Your boyfriend is in the cafe.	Твой парень в кафе.	-	Discuss possessions
your path	твой путь	-	Discuss possessions
my last life	моя прошлая жизнь	-	Discuss possessions
your dad and your mom	ваш папа и ваша мама	-	Discuss possessions
Children, this is your table.	Дети, это ваш стол.	-	Discuss possessions
your business	твоё дело	-	Discuss possessions
his mom	его мама	-	Discuss possessions
Her cat eats everything.	Её кошка ест всё.	-	Discuss possessions
Where is your radio?	Где твоё радио?	-	Discuss possessions
your taxi	ваше такси	-	Discuss possessions
this night	эта ночь	-	Discuss possessions
your teacher	ваш учитель	-	Discuss possessions
my word	моё слово	-	Discuss possessions
this week	эта неделя	-	Discuss possessions
my business	моё дело	-	Discuss possessions
Your mom is already here.	Ваша мама уже здесь.	-	Discuss possessions
Do you want bread?	Ты хочешь хлеб?	-	Make requests
Her cup is there.	Её чашка там.	-	Make requests
Do you want chicken?	Ты хочешь курицу?	-	Make requests
cup	чашка	-	Make requests
books	книги	-	Make requests
spoon	ложка	-	Make requests
She does not have a plate.	У неё нет тарелки.	-	Make requests
The boy does not have a plate.	У мальчика нет тарелки.	-	Make requests
The spoon is far from the plate.	Ложка далеко от тарелки.	-	Make requests
He wants a chicken.	Он хочет курицу.	-	Make requests
I want water. And you?	Я хочу воду. А вы?	-	Make requests
Ivan is reading our book.	Иван читает нашу книгу.	-	Make requests
He knows this girl.	Он знает эту девочку.	-	Make requests
Dima does not know Dad.	Дима не знает папу.	-	Make requests
Dima, do you want a snake?	Дима, ты хочешь змею?	-	Make requests
Mom, I see Dad.	Мама, я вижу папу.	-	Make requests
I don't see Nina.	Я не вижу Нину.	-	Make requests
Give me your plate.	Дайте мне вашу тарелку.	-	Make requests
Give me an apple, please.	Дайте мне яблоко, пожалуйста.	-	Make requests
I see a plate and a spoon.	Я вижу тарелку и ложку.	-	Make requests
Mom is reading.	Мама читает.	-	Make requests
I want rice and duck.	Я хочу рис и утку.	-	Make requests
I have a dog; I do not want a cat.	У меня собака, я не хочу кошку.	-	Make requests
Our horse drinks water.	Наша лошадь пьёт воду.	-	Make requests
I see water.	Я вижу воду.	-	Make requests
I want a dog.	Я хочу собаку.	-	Make requests
a plate and a spoon	тарелка и ложка	-	Make requests
Where is my spoon?	Где моя ложка?	-	Make requests
I do not eat chicken.	Я не ем курицу.	-	Make requests
Mom, I want a snake!	Мама, я хочу змею!	-	Make requests
I want a plate.	Я хочу тарелку.	-	Make requests
Give me juice, please.	Дайте мне сок, пожалуйста.	-	Make requests
four apples	четыре яблока	-	Use numbers
two nights	две ночи	-	Use numbers
three	три	-	Use numbers
two cups	две чашки	-	Use numbers
