English	Foreign	Transliteration	Context
I previously worked as a translator.	Я раньше работала переводчиком.	-	Discuss career plans
I already came to an agreement with him.	Я уже с ним договорился.	-	Discuss career plans
A programmer can be an artist.	Программист может быть художником.	-	Discuss career plans
boots	ботинки	-	Discuss placing things
A sheet of paper lies on the desk.	На столе лежит лист бумаги.	-	Discuss placing things
paper	бумага	-	Discuss placing things
The schedule is hanging upside down.	Расписание висит вверх ногами.	-	Discuss placing things
Usually I stand when I talk on the phone.	Обычно я стою, когда говорю по телефону.	-	Discuss placing things
umbrella	зонт	-	Discuss placing things
Let me sit here.	Дай мне сесть сюда.	-	Discuss placing things
Hang the shirt on a chair.	Повесь рубашку на стул.	-	Discuss placing things
The portrait is hanging right behind you.	Портрет висит прямо за тобой.	-	Discuss placing things
We will put the chair right here.	Мы поставим стул прямо сюда.	-	Discuss placing things
This shelf is very expensive.	Эта полка очень дорогая.	-	Discuss placing things
Hang the map of the subway here.	Повесь карту метро сюда.	-	Discuss placing things
Who will put flowers in the vase?	Кто поставит цветы в вазу?	-	Discuss placing things
I don't know where to hang these portraits.	Я не знаю, куда повесить эти портреты.	-	Discuss placing things
Take the dictionary from the shelf.	Возьми словарь с полки.	-	Discuss placing things
Boris bought apples and put them into the bag.	Борис купил яблоки и положил их в сумку.	-	Discuss placing things
cake	торт	-	Talk about dessert
a fresh apple	свежее яблоко	-	Talk about dessert
lemon	лимон	-	Talk about dessert
stove	плита	-	Talk about dessert
The lemon is not sweet.	Лимон не сладкий.	-	Talk about dessert
Excuse me, are these bags free?	Извините, эти пакеты бесплатные?	-	Talk about dessert
How much does this bag cost?	Сколько стоит этот пакет?	-	Talk about dessert
My daughter is drinking sweet tea.	Моя дочка пьёт сладкий чай.	-	Talk about dessert
a kilogram of meat	килограмм мяса	-	Talk about dessert
the fat cook	толстый повар	-	Talk about dessert
The porridge is warmer than the soup.	Каша теплее супа.	-	Talk about dessert
Maria eats tomatoes every day.	Мария ест помидоры каждый день.	-	Talk about dessert
We have just bought a kilogram of candy.	Мы только что купили килограмм конфет.	-	Talk about dessert
a yellow paper bag	пакет из жёлтой бумаги	-	Talk about dessert
The vendor is showing him fruit.	Продавец показывает ему фрукты.	-	Talk about dessert
The vendor said that the onions are fresh.	Продавец сказал, что лук свежий.	-	Talk about dessert
My uncle is very fat.	Мой дядя очень толстый.	-	Talk about dessert
a bottle of sauce	бутылка  соуса	-	Talk about dessert
a thin girl	худая девушка	-	Talk about dessert
a fresh lemon	свежий лимон	-	Talk about dessert
Sugar is sweet.	Сахар сладкий.	-	Talk about dessert
two kilograms	два килограмма	-	Talk about dessert
I am washing apples and tomatoes.	Я мою яблоки и помидоры.	-	Talk about dessert
I have an orange.	У меня есть апельсин.	-	Talk about dessert
The thing is that she is right.	Дело в том, что она права.	-	Express opinions
We had a long conversation.	У нас был долгий разговор.	-	Express opinions
I got the impression she was sleeping.	Мне показалось, что она спит.	-	Express opinions
No wonder that you fell.	Неудивительно, что ты упал.	-	Express opinions
She got the impression that I was busy.	Ей показалось, что я занят.	-	Express opinions
In your opinion, which computer is better?	По-твоему, какой компьютер лучше?	-	Express opinions
You think French is difficult?	По-вашему, французский язык сложный?	-	Express opinions
First of all, it is snowing; second, it is cold.	Во-первых, идёт снег, во-вторых, холодно.	-	Express opinions
I need to solve this problem by Monday.	Мне надо решить эту задачу к понедельнику.	-	Express opinions
You think I should become a teacher?	По-вашему, я должен стать учителем?	-	Express opinions
It is little wonder that you decided to ask me.	Неудивительно, что вы решили спросить меня.	-	Express opinions
Yes, you are right.	Да, ты прав.	-	Express opinions
What does he have in mind?	Что он имеет в виду?	-	Express opinions
I have the right to be here.	Я имею право здесь находиться.	-	Express opinions
Enough!	Хватит!	-	Express opinions
Can I have soup and potatoes?	Можно суп и картошку?	-	Express opinions
Mark had lunch in a cafe yesterday.	Марк вчера пообедал в кафе.	-	Wish for things
Have you eaten already?	Ты уже поел?	-	Wish for things
Tomorrow I will eat lunch at home.	Завтра я пообедаю дома.	-	Wish for things
She would play more if she wanted to.	Она бы играла больше, если бы хотела.	-	Wish for things
I would have bought bread if you had asked me.	Я бы купил хлеб, если бы ты меня попросил.	-	Wish for things
Mom asked us to feed the puppy.	Мама попросила, чтобы мы кормили щенка.	-	Wish for things
I want to get into this university.	Я хочу поступить в этот университет.	-	Wish for things
To get into a university one needs to know a lot.	Чтобы поступить в университет, нужно много знать.	-	Wish for things
Give me something to eat.	Дай мне что-нибудь поесть.	-	Wish for things
I want to have breakfast at the cafe.	Я хочу позавтракать в кафе.	-	Wish for things
The boss told me to write faster.	Начальник сказал мне, чтобы я писала быстрее.	-	Wish for things
She asked me to remember the schedule.	Она попросила меня, чтобы я помнил расписание.	-	Wish for things
Maria would study better if she were not late every day.	Мария бы лучше училась, если бы не опаздывала каждый день.	-	Wish for things
Tomorrow my legs are going to hurt.	Завтра у меня будут болеть ноги.	-	Say what will happen
The painting is going to hang over there.	Картина будет висеть вон там.	-	Say what will happen
Are you going to help me?	Вы будете мне помогать?	-	Say what will happen
Yes, she will help me.	Да, она мне будет помогать.	-	Say what will happen
What will we discuss tomorrow?	Что мы будем обсуждать завтра?	-	Say what will happen
Will you draw or take pictures?	Ты будешь рисовать или фотографировать?	-	Say what will happen
I will help them.	Я буду им помогать.	-	Say what will happen
Soon we will need to go home.	Скоро нам надо будет ехать домой.	-	Say what will happen
The pianist will give a concert on Sunday.	Пианист будет выступать на концерте в воскресенье.	-	Say what will happen
You will teach me to draw.	Ты будешь учить меня рисовать.	-	Say what will happen
I will be sitting on this couch.	Я буду сидеть на этом диване.	-	Say what will happen
On Tuesday Svetlana will cook porridge.	Во вторник Светлана будет варить кашу.	-	Say what will happen
In a year's time, everything will cost more.	Через год всё будет стоить больше.	-	Say what will happen
What is he going to draw?	Что он будет рисовать?	-	Say what will happen
Tomorrow we will be helping mom.	Завтра мы будем помогать маме.	-	Say what will happen
He will wash his car tomorrow.	Завтра он будет мыть свою машину.	-	Say what will happen
I will take pictures of you.	Я буду фотографировать тебя.	-	Say what will happen
Where will you put this chair?	Куда ты будешь ставить этот стул?	-	Say what will happen
You'll feel better tomorrow.	Ты завтра будешь лучше себя чувствовать.	-	Say what will happen
I do not want to sit here.	Я не хочу тут сидеть.	-	Say what will happen
In winter, I leave home at nine.	Зимой я ухожу из дома в девять.	-	Discuss travel
It is time for us to leave.	Нам пора уходить.	-	Discuss travel
She did not come on time.	Она не пришла вовремя.	-	Discuss travel
Why didn't you come to class?	Почему ты не пришла на занятия?	-	Discuss travel
Are you already going home?	Вы уже уходите домой?	-	Discuss travel
Unfortunately we are already leaving.	К сожалению, мы уже уходим.	-	Discuss travel
Can you leave?	Вы можете уйти?	-	Discuss travel
One person disembarked at this stop.	На этой остановке вышел один человек.	-	Discuss travel
The teacher left the class before I entered.	Учитель вышел из класса до того, как я вошла.	-	Discuss travel
She entered the restaurant and sat down at a table.	Она вошла в ресторан и села за стол.	-	Discuss travel
Why are you leaving the country?	Почему ты уезжаешь из страны?	-	Discuss travel
They will go abroad soon.	Они скоро уедут за границу.	-	Discuss travel
Mom has already left for work.	Мама уже ушла на работу.	-	Discuss travel
When are they leaving?	Когда они уезжают?	-	Discuss travel
Tomorrow I will come on time.	Завтра я приду вовремя.	-	Discuss travel
They entered the room.	Они вошли в комнату.	-	Discuss travel
Africa is beautiful.	Африка прекрасна.	-	Describe nature
volcano	вулкан	-	Describe nature
We are planting potatoes.	Мы сажаем картошку.	-	Describe nature
The sand is very hot today.	Сегодня песок очень горячий.	-	Describe nature
field	поле	-	Describe nature
desert	пустыня	-	Describe nature
cloud	облако	-	Describe nature
Some birds can't fly.	Некоторые птицы не могут летать.	-	Describe nature
Nina is planting eight flowers.	Нина сажает восемь цветов.	-	Describe nature
The waves are tossing the ship from side to side.	Волны бросают корабль из стороны в сторону.	-	Describe nature
a big white cloud	большое белое облако	-	Describe nature
He is fast as lightning.	Он быстрый как молния.	-	Describe nature
sand on the beach	песок на пляже	-	Describe nature
He is as cold as ice.	Он холодный как лёд.	-	Describe nature
It is hot in the desert.	В пустыне жарко.	-	Describe nature
This branch is too heavy.	Эта ветка слишком тяжёлая.	-	Describe nature
the ninth symphony	девятая симфония	-	Talk about the arts
This is my favorite album.	Это мой любимый альбом.	-	Talk about the arts
Is this a comedy?	Это комедия?	-	Talk about the arts
My wife likes nineteenth century music.	Моя жена любит музыку девятнадцатого века.	-	Talk about the arts
Mom likes seventeenth-century architecture.	Маме нравится архитектура семнадцатого века.	-	Talk about the arts
Your favorite movie is an old Russian comedy.	Твой любимый фильм — старая русская комедия.	-	Talk about the arts
Dima likes this TV show.	Дима любит этот сериал.	-	Talk about the arts
She is telling them about the university.	Она рассказывает им про университет.	-	Talk about the arts
Grandfather likes writing poems about Grandmother.	Дедушка любит писать стихи про бабушку.	-	Talk about the arts
What is this TV show about?	Про что этот сериал?	-	Talk about the arts
I am watching a Russian cartoon.	Я смотрю русский мультфильм.	-	Talk about the arts
My children are talented musicians.	Мои дети — талантливые музыканты.	-	Talk about the arts
a small stage	маленькая сцена	-	Talk about the arts
How many rows are there here?	Сколько тут рядов?	-	Talk about the arts
talented ballerina	талантливая балерина	-	Talk about the arts
How many channels are there here?	Сколько здесь каналов?	-	Talk about the arts
Let's watch television.	Давай посмотрим телевизор.	-	Suggest things to do
Vanya, let's draw something.	Ваня, давай что-нибудь нарисуем.	-	Suggest things to do
Today I am eating dinner at eight.	Я сегодня ужинаю в восемь.	-	Suggest things to do
Let's draw a beach and waves.	Давай нарисуем пляж и волны.	-	Suggest things to do
Let's spend the day in the park.	Давай проведём день в парке.	-	Suggest things to do
Dima often eats dinner in this restaurant.	Дима часто ужинает в этом ресторане.	-	Suggest things to do
Let's go to the beach to sunbathe.	Давайте пойдём на пляж загорать.	-	Suggest things to do
Let's go sunbathe together.	Давай пойдём загорать вдвоём.	-	Suggest things to do
Let's draw a stone.	Давай нарисуем камень.	-	Suggest things to do
Let's watch a different movie.	Давай посмотрим другой фильм.	-	Suggest things to do
Mark and Victoria live there together.	Марк и Виктория живут там вдвоём.	-	Suggest things to do
Let's buy one more bag.	Давайте купим ещё один пакет.	-	Suggest things to do
Let's get up at six tomorrow.	Давайте завтра встанем в шесть.	-	Suggest things to do
Let's watch TV.	Давай посмотрим телевизор.	-	Suggest things to do
We do not know each other.	Мы не знаем друг друга.	-	Suggest things to do
Mark is sunbathing on the roof.	Марк загорает на крыше.	-	Suggest things to do
They always eat dinner together.	Они всегда ужинают вдвоём.	-	Suggest things to do
We eat dinner together.	Мы ужинаем вдвоём.	-	Suggest things to do
They do not speak to each other.	Они не говорят друг с другом.	-	Suggest things to do
Sergei lives in a big house.	Сергей живёт в большом доме.	-	Use large numbers
marry	жениться	-	Use large numbers
Last month the average temperature was ten degrees.	В прошлом месяце средняя температура была десять градусов.	-	Use large numbers
eighty days	восемьдесят дней	-	Use large numbers
eighty	восемьдесят	-	Use large numbers
I was born in nineteen ninety-four.	Я родилась в тысяча девятьсот девяносто четвёртом.	-	Use large numbers
one thousand nine hundred seventy three	тысяча девятьсот семьдесят три	-	Use large numbers
How much does an average refrigerator cost?	Сколько стоит средний холодильник?	-	Use large numbers
Yes, today is the eleventh.	Да, сегодня одиннадцатое число.	-	Use large numbers
How do you say this number in Russian?	Как сказать это число по-русски?	-	Use large numbers
I bought three big couches.	Я купила три больших дивана.	-	Use large numbers
I paid five hundred dollars for this TV.	Я заплатил пятьсот долларов за этот телевизор.	-	Use large numbers
The price is five hundred thirty two rubles.	Цена — пятьсот тридцать два рубля.	-	Use large numbers
This was ninety years ago.	Это было девяносто лет назад.	-	Use large numbers
You paid seventy four rubles.	Ты заплатил семьдесят четыре рубля.	-	Use large numbers
three million	три миллиона	-	Use large numbers
I'm getting married in Germany.	Я женюсь в Германии.	-	Use large numbers
I have seventy pencils.	У меня семьдесят карандашей.	-	Use large numbers
Northern France	северная Франция	-	Talk about the seasons
an iron door	железная дверь	-	Talk about the seasons
Our grandmother is rich.	Наша бабушка богатая.	-	Talk about the seasons
ring	кольцо	-	Talk about the seasons
Spanish	испанский	-	Talk about the seasons
I will not give you my golden ring.	Я не дам тебе своё золотое кольцо.	-	Talk about the seasons
The Polish language is very complicated.	Польский язык — очень сложный.	-	Talk about the seasons
Polish is more similar to Russian than to English.	Польский язык более похож на русский, чем на английский.	-	Talk about the seasons
Who knows the correct answer?	Кто знает правильный ответ?	-	Talk about the seasons
There was an iron ring hanging on the door.	На двери висело железное кольцо.	-	Talk about the seasons
a full plate	полная тарелка	-	Talk about the seasons
West wind	западный ветер	-	Talk about the seasons
We are reading a fairy tale about a golden rooster.	Мы читаем сказку о золотом петухе.	-	Talk about the seasons
unhelpful advice	вредные советы	-	Talk about the seasons
three golden apples	три золотых яблока	-	Talk about the seasons
I want to finish this work by Saturday.	Я хочу закончить эту работу к субботе.	-	Discuss future plans
We are planning to spend almost all the money.	Мы собираемся потратить почти все деньги.	-	Discuss future plans
We were planning to return before eleven.	Мы собирались вернуться до одиннадцати.	-	Discuss future plans
Mark is going to return at five.	Марк собирается вернуться в пять.	-	Discuss future plans
A pity. I planned to spend a lot less.	Жаль. Я собиралась потратить гораздо меньше.	-	Discuss future plans
We're planning to bring them some books.	Мы собираемся принести им несколько книг.	-	Discuss future plans
I was going to bring candy.	Я собирался принести конфеты.	-	Discuss future plans
When are you planning to inspect the office?	Когда вы собираетесь осмотреть офис?	-	Discuss future plans
She is dating my brother.	Она встречается с моим братом.	-	Discuss future plans
The seagull returned to the nest.	Чайка вернулась в гнездо.	-	Discuss future plans
Mom plans to come to Russia every summer.	Мама собирается приезжать в Россию каждое лето.	-	Discuss future plans
We plan to visit you every year.	Мы собираемся приезжать к вам каждый год.	-	Discuss future plans
She wants to bring her article.	Она хочет принести свою статью.	-	Discuss future plans
I want to wash this dress.	Я хочу постирать это платье.	-	Discuss future plans
I don't plan to date him.	Я не собираюсь с ним встречаться.	-	Discuss future plans
Can you do this in twenty minutes?	Ты можешь это сделать за двадцать минут?	-	Express cause and effect
I know all the rules.	Я знаю все правила.	-	Express cause and effect
I will drive past this big park.	Я проеду мимо этого большого парка.	-	Express cause and effect
We passed by our school.	Мы прошли мимо нашей школы.	-	Express cause and effect
I walked through the whole park.	Я прошёл через весь парк.	-	Express cause and effect
I bought a pen instead of a pencil.	Я купила ручку вместо карандаша.	-	Express cause and effect
We will drive across the stone bridge.	Мы проедем через каменный мост.	-	Express cause and effect
Our path lies through the desert.	Наш путь лежит через пустыню.	-	Express cause and effect
It is against the rules.	Это против правил.	-	Express cause and effect
I drove past this city on the way home.	Я проехала мимо этого города по пути домой.	-	Express cause and effect
We were late because of you!	Из-за тебя мы опоздали!	-	Express cause and effect
Tanya was taking a walk despite the weather.	Таня гуляла несмотря на погоду.	-	Express cause and effect
You will not pass there.	Вы там не пройдёте.	-	Express cause and effect
We want the same thing.	Мы хотим одного и того же.	-	Express similarity
Write your name in the same place.	Напиши своё имя там же.	-	Express similarity
Yes, I bought the radio at the same time.	Да, я купил радио тогда же.	-	Express similarity
We have the same sweaters!	У нас одинаковые свитера!	-	Express similarity
They work at the same time we do.	Они работают тогда же, когда и мы.	-	Express similarity
But this is the exact same refrigerator!	Но это тот же самый холодильник!	-	Express similarity
It is the exact same actress.	Это та же самая актриса.	-	Express similarity
Maria and Vera live in the same house.	Мария и Вера живут в одном и том же доме.	-	Express similarity
We watched the same movie.	Мы смотрели один и тот же фильм.	-	Express similarity
She is my first love.	Она – моя первая любовь.	-	Learn noun spelling changes
seven bottles	семь бутылок	-	Learn noun spelling changes
love	любовь	-	Learn noun spelling changes
The wind broke several branches.	Ветер сломал несколько веток.	-	Learn noun spelling changes
pepper	перец	-	Learn noun spelling changes
I have seven pens.	У меня семь ручек.	-	Learn noun spelling changes
a pencil and five pens	карандаш и пять ручек	-	Learn noun spelling changes
There is no smoke without fire.	Нет дыма без огня.	-	Learn noun spelling changes
There are nine pens in the box.	В коробке девять ручек.	-	Learn noun spelling changes
I have many empty jars.	У меня много пустых банок.	-	Learn noun spelling changes
How many jars do you have?	Сколько у вас банок?	-	Learn noun spelling changes
six jars	шесть банок	-	Learn noun spelling changes
forty branches	сорок веток	-	Learn noun spelling changes
Get away from the fire!	Отойди от огня!	-	Learn noun spelling changes
We found six rings.	Мы нашли шесть колец.	-	Learn noun spelling changes
The child is building something out of sand.	Ребёнок строит что-то из песка.	-	Learn noun spelling changes
The spacecraft is approaching the Earth.	Космический аппарат приближается к Земле.	-	Discuss outer space
planet	планета	-	Discuss outer space
Vera wants to become a cosmonaut.	Вера хочет стать космонавтом.	-	Discuss outer space
outer space	космос	-	Discuss outer space
Mars orbits the Sun.	Марс вращается вокруг Солнца.	-	Discuss outer space
moon	луна	-	Discuss outer space
The Moon orbits the Earth.	Луна вращается вокруг Земли.	-	Discuss outer space
Do we know the size of the Universe?	Мы знаем размер Вселенной?	-	Discuss outer space
Mars is the fourth planet from the Sun.	Марс — четвёртая планета от Солнца.	-	Discuss outer space
The Earth orbits the Sun.	Земля вращается вокруг Солнца.	-	Discuss outer space
The cosmonauts arrived at the International Space Station.	Космонавты прилетели на Международную космическую станцию.	-	Discuss outer space
